{"decision":"INCOMPLETE_NO_HUMAN_DECISION","errors":[],"families":[{"adjudication_complete":false,"assignment_freeze_pass":true,"computed_tier":"P0_MACHINE_CANDIDATE","critical_pass":false,"family_id":"future.vsa.field.demonstration","independence_pass":false,"minimality_necessity_pass":false,"new_sufficient_routes":0,"outcome":"incomplete","pair_isolation_pass":false,"pre_adjudication_roles_complete":false,"reason_codes":["REQUIRED_ROLE_INCOMPLETE","SATURATION_AUDIT_INCOMPLETE"],"rights_privacy_safety_pass":false,"roles_complete":false,"saturation_audit_complete":false,"saturation_pass":false,"source_exposure_ledger_pass":true,"source_group_blindness_pass":true,"source_id":"future-source-005","starting_tier":"P0_MACHINE_CANDIDATE","validator_agreement":null},{"adjudication_complete":false,"assignment_freeze_pass":true,"computed_tier":"P1_MACHINE_CROSS_VALIDATED","critical_pass":false,"family_id":"future.vsa.field.demonstration.second","independence_pass":false,"minimality_necessity_pass":false,"new_sufficient_routes":0,"outcome":"incomplete","pair_isolation_pass":false,"pre_adjudication_roles_complete":false,"reason_codes":["REQUIRED_ROLE_INCOMPLETE","SATURATION_AUDIT_INCOMPLETE"],"rights_privacy_safety_pass":false,"roles_complete":false,"saturation_audit_complete":false,"saturation_pass":false,"source_exposure_ledger_pass":true,"source_group_blindness_pass":true,"source_id":"future-source-005","starting_tier":"P1_MACHINE_CROSS_VALIDATED","validator_agreement":null},{"adjudication_complete":false,"assignment_freeze_pass":true,"computed_tier":"P0_MACHINE_CANDIDATE","critical_pass":false,"family_id":"future.ambient.factory.alarm","independence_pass":false,"minimality_necessity_pass":false,"new_sufficient_routes":0,"outcome":"incomplete","pair_isolation_pass":false,"pre_adjudication_roles_complete":false,"reason_codes":["REQUIRED_ROLE_INCOMPLETE","SATURATION_AUDIT_INCOMPLETE"],"rights_privacy_safety_pass":false,"roles_complete":false,"saturation_audit_complete":false,"saturation_pass":false,"source_exposure_ledger_pass":true,"source_group_blindness_pass":true,"source_id":"future-source-004","starting_tier":"P0_MACHINE_CANDIDATE","validator_agreement":null},{"adjudication_complete":false,"assignment_freeze_pass":true,"computed_tier":"P1_MACHINE_CROSS_VALIDATED","critical_pass":false,"family_id":"current.noaa01-r004-surf-av","independence_pass":false,"minimality_necessity_pass":false,"new_sufficient_routes":0,"outcome":"incomplete","pair_isolation_pass":false,"pre_adjudication_roles_complete":false,"reason_codes":["REQUIRED_ROLE_INCOMPLETE","SATURATION_AUDIT_INCOMPLETE"],"rights_privacy_safety_pass":false,"roles_complete":false,"saturation_audit_complete":false,"saturation_pass":false,"source_exposure_ledger_pass":true,"source_group_blindness_pass":true,"source_id":"cand-049","starting_tier":"P1_MACHINE_CROSS_VALIDATED","validator_agreement":null},{"adjudication_complete":false,"assignment_freeze_pass":true,"computed_tier":"P2_MACHINE_COUNTERFACTUAL_VALIDATED","critical_pass":false,"family_id":"current.noaa01-r016-three-factors-vs","independence_pass":false,"minimality_necessity_pass":false,"new_sufficient_routes":0,"outcome":"incomplete","pair_isolation_pass":false,"pre_adjudication_roles_complete":false,"reason_codes":["REQUIRED_ROLE_INCOMPLETE","SATURATION_AUDIT_INCOMPLETE"],"rights_privacy_safety_pass":false,"roles_complete":false,"saturation_audit_complete":false,"saturation_pass":false,"source_exposure_ledger_pass":true,"source_group_blindness_pass":true,"source_id":"cand-052","starting_tier":"P2_MACHINE_COUNTERFACTUAL_VALIDATED","validator_agreement":null},{"adjudication_complete":false,"assignment_freeze_pass":true,"computed_tier":"P1_MACHINE_CROSS_VALIDATED","critical_pass":false,"family_id":"future.va.wildlife","independence_pass":false,"minimality_necessity_pass":false,"new_sufficient_routes":0,"outcome":"incomplete","pair_isolation_pass":false,"pre_adjudication_roles_complete":false,"reason_codes":["REQUIRED_ROLE_INCOMPLETE","SATURATION_AUDIT_INCOMPLETE"],"rights_privacy_safety_pass":false,"roles_complete":false,"saturation_audit_complete":false,"saturation_pass":false,"source_exposure_ledger_pass":true,"source_group_blindness_pass":true,"source_id":"future-source-009","starting_tier":"P1_MACHINE_CROSS_VALIDATED","validator_agreement":null},{"adjudication_complete":false,"assignment_freeze_pass":true,"computed_tier":"P2_MACHINE_COUNTERFACTUAL_VALIDATED","critical_pass":false,"family_id":"future.v.museum.tour","independence_pass":false,"minimality_necessity_pass":false,"new_sufficient_routes":0,"outcome":"incomplete","pair_isolation_pass":false,"pre_adjudication_roles_complete":false,"reason_codes":["REQUIRED_ROLE_INCOMPLETE","SATURATION_AUDIT_INCOMPLETE"],"rights_privacy_safety_pass":false,"roles_complete":false,"saturation_audit_complete":false,"saturation_pass":false,"source_exposure_ledger_pass":true,"source_group_blindness_pass":true,"source_id":"future-source-008","starting_tier":"P2_MACHINE_COUNTERFACTUAL_VALIDATED","validator_agreement":null},{"adjudication_complete":false,"assignment_freeze_pass":true,"computed_tier":"P1_MACHINE_CROSS_VALIDATED","critical_pass":false,"family_id":"future.ambient.factory.alarm.second","independence_pass":false,"minimality_necessity_pass":false,"new_sufficient_routes":0,"outcome":"incomplete","pair_isolation_pass":false,"pre_adjudication_roles_complete":false,"reason_codes":["REQUIRED_ROLE_INCOMPLETE","SATURATION_AUDIT_INCOMPLETE"],"rights_privacy_safety_pass":false,"roles_complete":false,"saturation_audit_complete":false,"saturation_pass":false,"source_exposure_ledger_pass":true,"source_group_blindness_pass":true,"source_id":"future-source-004","starting_tier":"P1_MACHINE_CROSS_VALIDATED","validator_agreement":null}],"generated_at":"2026-09-23T11:44:34+00:00","human_review_occurred":false,"record_type":"construct_validation_import_report","schema_version":"1.0.0","statistics":{"acceptance_funnel":{"adjudicated":0,"all_roles_complete":0,"h1_or_h2":0,"h2":0,"pre_adjudication_roles_complete":0,"reject":0,"repair":0,"sampled":8,"saturation_audited":0},"agreement":{"critical_label_cohens_kappa":null,"critical_label_pair_count":0,"family_outcome_cohens_kappa":null,"family_pair_count":0},"all_machine_tier_h1_precision_estimate":{"denominator_complete":0,"estimate":null,"numerator_h1_or_h2":0,"wilson_95_ci":null},"alternative_ses_discovery":{"families_with_new_alternative_ses":0,"family_discovery_rate":null,"new_alternative_ses":0,"per_completed_family":null,"wilson_95_ci":null},"construct_failure":{"denominator_complete":0,"families_failing_minimality_necessity_or_modality":0,"rate":null,"wilson_95_ci":null},"labor":{"minutes_per_complete_family":null,"total_active_minutes":0.0},"low_n_warning":"LOW_N_MINI_PILOT_DESCRIPTIVE_ONLY","machine_tier_h1_precision_estimates":{"P0_MACHINE_CANDIDATE":{"denominator_complete":0,"estimate":null,"numerator_h1_or_h2":0,"wilson_95_ci":null},"P1_MACHINE_CROSS_VALIDATED":{"denominator_complete":0,"estimate":null,"numerator_h1_or_h2":0,"wilson_95_ci":null},"P2_MACHINE_COUNTERFACTUAL_VALIDATED":{"denominator_complete":0,"estimate":null,"numerator_h1_or_h2":0,"wilson_95_ci":null}},"minimality_pass":{"denominator":0,"passes":0,"rate":null,"wilson_95_ci":null},"necessity_group_pass":{"denominator":0,"passes":0,"rate":null,"wilson_95_ci":null},"p2_acceptance_precision_estimate":{"denominator_reviewed_p2":0,"estimate":null,"numerator_h2":0,"wilson_95_ci":null},"packet_declared_unfilled":true,"pair_isolation_failure":{"denominator_complete":0,"failures":0,"rate":null,"wilson_95_ci":null},"reviewer_governance":{"assignment_freeze_pass":true,"assignment_status":"DRAFT_NOT_DISTRIBUTABLE","exposure_event_count":0,"source_exposure_ledger_pass":true,"source_group_blindness_pass":true,"source_group_count":6},"saturation_audit":{"completed_families":0,"families_with_new_sufficient_routes":0,"new_sufficient_routes":0,"saturated_families":0},"temporal_interval_agreement":{"mean_temporal_iou":null,"single_interval_pairs":0}}}
